title,winery,grape,vintage,isblend,height,min-diam,max-diam,weight,rating-spectator,rating-advocate,rating-cellar,objectid,price,color,basecolor,latitude,longitude,location,filename,type,format,subregion,region,country
Francis Ford Coppola Diamond Collection Cabernet Sauvignon,Francis Coppola,Cabernet Sauvignon,2019,FALSE,4.45,1.91,2.06,29.4,N/A,N/A,86.8,CoppCabSauvCork01,18.99,#ecd37b,#e2b2b0,38.6795595,-122.8923422,"Paso Robles, California, United States",CoppCabSauvCork010.jpg; CoppCabSauvCork011.jpg; CoppCabSauvCork012.jpg; CoppCabSauvCork013.jpg; CoppCabSauvCork01top.jpg; CoppCabSauvCork01base.jpg,Image;StillImage,image/jpg,Paso Robles,California,United States
Barone Cornacchia Montepulciano d'Abruzzo,Barone Cornacchia,Montepulciano,2019,FALSE,,,,,N/A,N/A,87.3,BarCornMonteCork02,17.99,,,42.811167,13.760694,"Torano Nuovo, Abruzzo, Italy",BarCornMonteCork020.jpg; BarCornMonteCork021.jpg; BarCornMonteCork022.jpg; BarCornMonteCork023.jpg; BarCornMonteCork02top.jpg; BarCornMonteCork02base.jpg,Image;StillImage,image/jpg,Torano Nuovo,Abruzzo,Italy
La Marca Prosecco,La Marca Vini e Spumanti,Champagne,2020,FALSE,,,,,78,85,89,LaMarcaProCork03,19.99,,,45.8083443,12.4964763,"Treviso, Veneto, Italy",LaMarcaProCork030.jpg; LaMarcaProCork031.jpg; LaMarcaProCork032.jpg; LaMarcaProCork033.jpg; LaMarcaProCork03top.jpg; LaMarcaProCork03base.jpg,Image;StillImage,image/jpg,Treviso,Veneto,Italy
Ruffino Prosecco,Ruffino,Glera,2021,FALSE,,,,,N/A,N/A,86,RuffinoProCork04,16.99,,,45.672523,12.5803158,"Treviso, Veneto, Italy",RuffinoProCork040.jpg; RuffinoProCork041.jpg; RuffinoProCork042.jpg; RuffinoProCork043.jpg; RuffinoProCork04top.jpg; RuffinoProCork04base.jpg,Image;StillImage,image/jpg,Treviso,Veneto,Italy
Carlin de Paolo Barbera d'Asti,Carlin de Paolo,Barbera,2019,FALSE,,,,,N/A,N/A,89,CarlinBarbAstiCork05,16.99,,,44.8496582,8.0250424,"Asti, Piedmont, Italy",CarlinBarbAstiCork050.jpg; CarlinBarbAstiCork051.jpg; CarlinBarbAstiCork052.jpg; CarlinBarbAstiCork053.jpg; CarlinBarbAstiCork05top.jpg; CarlinBarbAstiCork05base.jpg,Image;StillImage,image/jpg,Asti,Piedmont,Italy
Juggernaut Cabernet Sauvignon,Juggernaut Wine Company,Cabernet Sauvignon,2017,FALSE,,,,,N/A,N/A,87.8,JuggCabSauvCork06,19.99,,,38.3892459,-121.5435858,"Central Valley, California, United States",JuggCabSauvCork060.jpg; JuggCabSauvCork061.jpg; JuggCabSauvCork062.jpg; JuggCabSauvCork063.jpg; JuggCabSauvCork06top.jpg; JuggCabSauvCork06base.jpg,Image;StillImage,image/jpg,Central Valley,California,United States
Juggernaut Pinot Noir,Juggernaut Wine Company,Pinot Noir,2019,FALSE,,,,,N/A,N/A,86.6,JuggPinNoirCork07,19.99,,,38.4830002,-122.8260863,"Russian River Valley, California, United States",JuggPinNoirCork070.jpg; JuggPinNoirCork071.jpg; JuggPinNoirCork072.jpg; JuggPinNoirCork073.jpg; JuggPinNoirCork07top.jpg; JuggPinNoirCork07base.jpg,Image;StillImage,image/jpg,Russian River Valley,California,United States
